source;date;destination;ltid
Chennai, India, Chennai Arpt[MAA];15/10/2017;New Delhi,India,Indira Gandhi Intl[DEL];4
Bangalore, India, Bengaluru Intl Arpt[BLR];03/10/17;Mumbai, India, Chhatrapati Shivaji[BOM];32
Bangalore, India, Bengaluru Intl Arpt[BLR];03/10/17;Chennai, India, Chennai Arpt[MAA];8
Tiruchirapally, India, Tiruchirapally Civil Arpt - Trichy[TRZ];03/10/17;New Delhi,India,Indira Gandhi Intl[DEL];2
Coimbatore, India, Peelamedu Airport[CJB];03/10/17;Kolkata, India, Netaji Subhas Chandra Bose Intl[CCU];10
Chennai, India, Chennai Arpt[MAA];09/10/2017;Jaipur, India, Sanganeer Arpt[JAI];8
Hyderabad (Shamshabad), India, Rajiv Gandhi Intl Arpt[HYD];25/10/2017;Kochi, India, Cochin Intl Arpt[COK];36